{
  "stage_id": "cleanup-quarantine-manager",
  "generated_at": "2026-03-16T05:36:37.951Z",
  "mode": "classify",
  "output_dir": "tests/reports/repo-audit-pipeline-unit/1773639397666/audit",
  "quarantine_session_root": "",
  "moved_count": 0,
  "entries": [
    {
      "path": "tasks/reports/link-health/link-audit-2026-03-09.json",
      "reason": "Large report artifact should move to retention/archive policy path after summary extraction.",
      "confidence": 0.63,
      "action": "delete-later",
      "restore_hint": "",
      "review_owner": "docs",
      "source_stage": "cleanup-quarantine-manager"
    },
    {
      "path": "tasks/reports/link-health/link-audit-2026-03-09.md",
      "reason": "Large report artifact should move to retention/archive policy path after summary extraction.",
      "confidence": 0.63,
      "action": "delete-later",
      "restore_hint": "",
      "review_owner": "docs",
      "source_stage": "cleanup-quarantine-manager"
    },
    {
      "path": "tasks/reports/link-health/link-audit-post-fix-2026-03-09.json",
      "reason": "Large report artifact should move to retention/archive policy path after summary extraction.",
      "confidence": 0.63,
      "action": "delete-later",
      "restore_hint": "",
      "review_owner": "docs",
      "source_stage": "cleanup-quarantine-manager"
    },
    {
      "path": "tasks/reports/link-health/link-audit-post-fix-2026-03-09.md",
      "reason": "Large report artifact should move to retention/archive policy path after summary extraction.",
      "confidence": 0.63,
      "action": "delete-later",
      "restore_hint": "",
      "review_owner": "docs",
      "source_stage": "cleanup-quarantine-manager"
    },
    {
      "path": "tasks/reports/navigation-links/anchor-errors-baseline.json",
      "reason": "Large report artifact should move to retention/archive policy path after summary extraction.",
      "confidence": 0.63,
      "action": "delete-later",
      "restore_hint": "",
      "review_owner": "docs",
      "source_stage": "cleanup-quarantine-manager"
    },
    {
      "path": "tasks/reports/navigation-links/LINK_TEST_REPORT.json",
      "reason": "Large report artifact should move to retention/archive policy path after summary extraction.",
      "confidence": 0.63,
      "action": "delete-later",
      "restore_hint": "",
      "review_owner": "docs",
      "source_stage": "cleanup-quarantine-manager"
    },
    {
      "path": "tasks/reports/navigation-links/LINK_TEST_REPORT.md",
      "reason": "Large report artifact should move to retention/archive policy path after summary extraction.",
      "confidence": 0.63,
      "action": "delete-later",
      "restore_hint": "",
      "review_owner": "docs",
      "source_stage": "cleanup-quarantine-manager"
    },
    {
      "path": "tasks/reports/repo-ops/SCRIPT_INVENTORY_FULL.json",
      "reason": "Large report artifact should move to retention/archive policy path after summary extraction.",
      "confidence": 0.63,
      "action": "delete-later",
      "restore_hint": "",
      "review_owner": "docs",
      "source_stage": "cleanup-quarantine-manager"
    },
    {
      "path": "tasks/reports/v1-v2-mapping-audit/v1-v2-page-mapping-adjudication-queue.json",
      "reason": "Large report artifact should move to retention/archive policy path after summary extraction.",
      "confidence": 0.63,
      "action": "delete-later",
      "restore_hint": "",
      "review_owner": "docs",
      "source_stage": "cleanup-quarantine-manager"
    },
    {
      "path": "tasks/reports/v1-v2-mapping-audit/v1-v2-page-mapping-audit.json",
      "reason": "Large report artifact should move to retention/archive policy path after summary extraction.",
      "confidence": 0.63,
      "action": "delete-later",
      "restore_hint": "",
      "review_owner": "docs",
      "source_stage": "cleanup-quarantine-manager"
    }
  ],
  "summary": {
    "keep": 0,
    "quarantine": 0,
    "delete-later": 10,
    "total": 10
  }
}
